{
  "schema_version": 1,
  "id": "nuphy-kick75-io",
  "name": "NuPhy Kick75 IO",
  "protocol": "nuphy_io_s4",
  "usb": {
    "vendor_id": 6645,
    "product_id": 4134,
    "usage_page": 1,
    "usage": 0,
    "report_bytes": 64,
    "interface_number": 3
  },
  "firmware": {
    "family": "nuphy-io-s4",
    "versions": [
      "4.0.18.6"
    ]
  },
  "verified_on": [
    {
      "platform": "macos",
      "architecture": "aarch64",
      "firmware": "4.0.18.6",
      "profile": "mac",
      "transport": "usb",
      "zone": "main",
      "evidence": [
        "docs/evidence/kick75-main-20261026.json",
        "docs/hardware/kick75.md"
      ]
    }
  ],
  "layout": null,
  "capabilities": {
    "solid_main": true,
    "per_key": false,
    "readback": true,
    "restore": true,
    "max_frames_per_second": 0
  },
  "verification": "experimental",
  "evidence": [
    "docs/hardware/kick75.md",
    "docs/evidence/kick75-main-20261026.json",
    "https://github.com/Pixelmoss/codex-kick75-status-lights/blob/e32648ee86a8a729734060ac09bd7f8a1213876f/docs/PROTOCOL.md"
  ]
}
